{
  "$schema": "http://json-schema.org/draft-07/schema#",
  "title": "EnemyDefinition",
  "type": "object",
  "required": ["id", "name", "sprite", "hp", "states"],
  "properties": {
    "id": { "type": ["integer", "string"] },
    "name": { "type": "string" },
    "sprite": { "type": "string" },
    "hp": { "type": "number", "minimum": 1 },
    "speed": { "type": "number", "minimum": 0 },
    "attack": {
      "type": "object",
      "properties": {
        "damage": { "type": "number" },
        "range": { "type": "number" },
        "cooldown": { "type": "number" },
        "projectileCount": { "type": "integer", "minimum": 1 },
        "spread": { "type": "number" }
      },
      "additionalProperties": true
    },
    "states": {
      "type": "object",
      "patternProperties": {
        ".+": {
          "type": "object",
          "properties": {
            "behaviours": {
              "type": "array",
              "items": {
                "oneOf": [
                  { "type": "string" },
                  {
                    "type": "object",
                    "required": ["type"],
                    "properties": {
                      "type": { "type": "string" },
                      "params": { "type": "object" }
                    },
                    "additionalProperties": false
                  }
                ]
              }
            },
            "transitions": {
              "type": "array",
              "items": {
                "type": "object",
                "required": ["type", "target"],
                "properties": {
                  "type": { "type": "string" },
                  "target": { "type": "string" }
                },
                "additionalProperties": true
              }
            }
          },
          "additionalProperties": false
        }
      }
    },
    "loot": { "type": "object" }
  },
  "additionalProperties": false
} 